{
   "mobile" : 0,
   "conversation-title" : "Then treat me that way",
   "url" : "http://tumblr.ggvaidya.com/post/118973659604",
   "id" : "118973659604",
   "feed-item" : "",
   "unix-timestamp" : 1431638994,
   "date" : "Thu, 14 May 2015 15:29:54",
   "slug" : "then-treat-me-that-way",
   "from-feed-id" : 0,
   "type" : "conversation",
   "url-with-slug" : "http://tumblr.ggvaidya.com/post/118973659604/then-treat-me-that-way",
   "reblog-key" : "fis2UAGq",
   "format" : "html",
   "tags" : [
      "life",
      "love",
      "family",
      "californication"
   ],
   "conversation" : [
      {
         "phrase" : "There is no right or wrong, dad, just the consequences of your actions. You taught me that.",
         "name" : "Becca Moody",
         "label" : "Becca Moody:"
      },
      {
         "label" : "Hank Moody:",
         "name" : "Hank Moody",
         "phrase" : "I guess I don't like the consequences of my actions very much right now."
      },
      {
         "label" : "Becca:",
         "name" : "Becca",
         "phrase" : "Yeah. Me neither."
      },
      {
         "label" : "",
         "name" : "",
         "phrase" : "[pause]"
      },
      {
         "phrase" : "So, uh ... what is it that you like so much about this boy?",
         "name" : "Hank",
         "label" : "Hank:"
      },
      {
         "phrase" : "I don't know.",
         "label" : "Becca:",
         "name" : "Becca"
      },
      {
         "phrase" : "Come on. It's got to be something. Use your words.",
         "name" : "Hank",
         "label" : "Hank:"
      },
      {
         "phrase" : "He's really smart.",
         "label" : "Becca:",
         "name" : "Becca"
      },
      {
         "phrase" : "Oh. Let's not go crazy.",
         "label" : "Hank:",
         "name" : "Hank"
      },
      {
         "name" : "Becca",
         "label" : "Becca:",
         "phrase" : "[slight embarrassment] And he makes me feel pretty."
      },
      {
         "name" : "Hank",
         "label" : "Hank:",
         "phrase" : "Well, that you are. You're very pretty. You're beautiful."
      },
      {
         "name" : "Becca",
         "label" : "Becca:",
         "phrase" : "Shut up. I'm not beautiful."
      },
      {
         "phrase" : "Don't say that. Look. Don't ever say that, you are BEAUTIFUL, you are the most beautiful thing in the world to me.",
         "label" : "Hank:",
         "name" : "Hank"
      },
      {
         "label" : "Becca:",
         "name" : "Becca",
         "phrase" : "[annoyed] Then treat me that way. [voice breaking] I'm ALWAYS on your side, dad, always. Even when I shouldn't be. But I'm sick of it. Get your shit together before it's too late. I don't CARE if you and mom never say another kind word to each other, but I'm sick and tired of parenting you both. <em>I'm a fucking kid</em>, I don't know what I'm doing half the time. But I do know this -- if you keep cracking jokes and taking another drink and pretending that life is one big, stupid party, you will miss everything."
      }
   ],
   "date-gmt" : "2015-05-14 21:29:54 GMT",
   "conversation-text" : "Becca Moody: There is no right or wrong, dad, just the consequences of your actions. You taught me that.\nHank Moody: I guess I don't like the consequences of my actions very much right now.\nBecca:  Yeah. Me neither.\n[pause]\nHank: So, uh ... what is it that you like so much about this boy?\nBecca: I don't know.\nHank: Come on. It's got to be something. Use your words.\nBecca: He's really smart.\nHank: Oh. Let's not go crazy.\nBecca: [slight embarrassment] And he makes me feel pretty.\nHank: Well, that you are. You're very pretty. You're beautiful.\nBecca: Shut up. I'm not beautiful.\nHank: Don't say that. Look. Don't ever say that, you are BEAUTIFUL, you are the most beautiful thing in the world to me.\nBecca: [annoyed] Then treat me that way. [voice breaking] I'm ALWAYS on your side, dad, always. Even when I shouldn't be. But I'm sick of it. Get your shit together before it's too late. I don't CARE if you and mom never say another kind word to each other, but I'm sick and tired of parenting you both. <em>I'm a fucking kid</em>, I don't know what I'm doing half the time. But I do know this -- if you keep cracking jokes and taking another drink and pretending that life is one big, stupid party, you will miss everything.",
   "bookmarklet" : 0
}

